{
  "$schema": "http://json-schema.org/draft-07/schema#",
  "$id": "visual-tokens.schema.json",
  "title": "Channel Visual Tokens",
  "description": "Ánh xạ vai trò màu sang giá trị. Layout chỉ tham chiếu vai trò.",
  "type": "object",
  "additionalProperties": false,
  "required": ["channel", "version", "colors", "typography", "grid", "motion"],
  "properties": {
    "$schemaRef": { "type": "string" },
    "$note": {
      "type": "string",
      "description": "Ghi chú xuất xứ của agent (🤖). Không phải trường nghiệp vụ."
    },
    "channel": { "type": "string" },
    "version": { "type": "string" },
    "note": { "type": "string" },
    "colors": {
      "type": "object",
      "additionalProperties": false,
      "required": ["bg", "surface", "ink", "ink-muted", "accent", "warn", "positive", "negative", "grid"],
      "properties": {
        "bg": { "type": "string" }, "surface": { "type": "string" }, "ink": { "type": "string" },
        "ink-muted": { "type": "string" }, "accent": { "type": "string" }, "warn": { "type": "string" },
        "positive": { "type": "string" }, "negative": { "type": "string" }, "grid": { "type": "string" }
      }
    },
    "typography": { "type": "object", "additionalProperties": true },
    "grid": { "type": "object", "additionalProperties": true },
    "motion": { "type": "object", "additionalProperties": true },
    "imagePromptSuffix": { "type": "string" }
  }
}
